<?xml version="1.0" encoding="UTF-8"?>
<xs:schema xmlns:xs="http://www.w3.org/2001/XMLSchema" elementFormDefault="qualified"
  xmlns:xsi="http://www.w3.org/2001/XMLSchema-instance" xmlns:xi="http://www.w3.org/2001/XInclude"
    xmlns:vc="http://www.w3.org/2007/XMLSchema-versioning" vc:minVersion="1.0" vc:maxVersion="1.1">
  <xs:import namespace="http://www.w3.org/XML/1998/namespace" schemaLocation="http://www.w3.org/2001/xml.xsd" />
  <xs:import namespace="http://www.w3.org/2001/XInclude" schemaLocation="http://www.w3.org/2001/XInclude/XInclude.xsd"/>
  <xs:element name="offerte">
    <xs:complexType>
      <xs:sequence>
        <xs:element ref="meta"/>
        <xs:element maxOccurs="unbounded" ref="section"/>
        <xs:element maxOccurs="unbounded" minOccurs="0" ref="annex"/>
        <xs:element maxOccurs="unbounded" minOccurs="1" ref="generate_waivers"/>
      </xs:sequence>
    </xs:complexType>
  </xs:element>
  <xs:element name="meta">
    <xs:complexType>
      <xs:sequence>
        <xs:element ref="offered_service_long"/>
        <xs:element ref="offered_service_short"/>
        <xs:element ref="ros"/>
        <xs:element ref="targets"/>
        <xs:element ref="permission_parties"/>
        <xs:element ref="pentestinfo"/>
        <xs:element ref="version_history"/>
      </xs:sequence>
    </xs:complexType>
  </xs:element>
  <xs:element name="offered_service_long" type="xs:string"/>
  <xs:element name="offered_service_short" type="xs:string"/>
  <xs:element name="full_name" type="xs:string"/>
  <xs:element name="short_name" type="xs:string"/>
  <xs:element name="city" type="xs:string"/>
  <xs:element name="country" type="xs:string"/>
  <xs:element name="coc">
    <xs:complexType>
      <xs:simpleContent>
        <xs:extension base="xs:integer">
          <xs:attribute name="nationality" type="xs:string" />
        </xs:extension>
      </xs:simpleContent>
    </xs:complexType>
  </xs:element>
  <xs:element name="legal_rep" type="xs:string"/>
  <xs:element name="waiver_rep" type="xs:string"/>
  <xs:element name="ros">
    <xs:complexType>
      <xs:sequence>
        <xs:element ref="full_name"/>
        <xs:element ref="short_name"/>
        <xs:element ref="legal_rep"/>
        <xs:element ref="poc1"/>
        <xs:element ref="address"/>
        <xs:element ref="postal_code"/>
        <xs:element ref="city"/>
        <xs:element ref="country"/>
        <xs:element ref="email"/>
      </xs:sequence>
      <xs:attribute ref="xml:base"/>
    </xs:complexType>
  </xs:element>
  <xs:element name="poc1" type="xs:string"/>
  <xs:element name="postal_code" type="xs:string"/>
  <xs:element name="targets">
    <xs:complexType>
      <xs:sequence>
        <xs:element maxOccurs="unbounded" ref="target"/>
      </xs:sequence>
    </xs:complexType>
  </xs:element>
  <xs:element name="target" type="xs:string"/>
  <xs:element name="permission_parties">
    <xs:complexType>
      <xs:sequence>
        <xs:element maxOccurs="1" ref="client"/>
        <xs:element maxOccurs="unbounded" minOccurs="0" ref="party"/>
      </xs:sequence>
    </xs:complexType>
  </xs:element>
  <xs:element name="party">
    <xs:complexType>
      <xs:sequence>
        <xs:element ref="full_name"/>
        <xs:element ref="short_name"/>
        <xs:element ref="waiver_rep"/>
        <xs:element ref="address"/>
        <xs:element ref="city"/>
        <xs:element ref="country"/>
        <xs:element minOccurs="0" ref="coc"/>
      </xs:sequence>
    </xs:complexType>
  </xs:element>
  <xs:element name="client">
    <xs:complexType>
      <xs:sequence>
        <xs:element ref="full_name"/>
        <xs:element ref="short_name"/>
        <xs:element ref="legal_rep"/>
        <xs:element ref="waiver_rep"/>
        <xs:element ref="poc1"/>
        <xs:element ref="address"/>
        <xs:element ref="city"/>
        <xs:element ref="country"/>
        <xs:element minOccurs="0" ref="coc"/>
      </xs:sequence>
    </xs:complexType>
  </xs:element>
  <xs:element name="pentestinfo">
    <xs:complexType>
      <xs:sequence>
        <xs:element ref="duration"/>
        <xs:element ref="test_planning"/>
        <xs:element ref="report_writing"/>
        <xs:element ref="report_due"/>
        <xs:element ref="nature"/>
        <xs:element ref="type"/>
        <xs:element ref="fee"/>
        <xs:element minOccurs="0" ref="target_application"/>
        <xs:element minOccurs="0" ref="target_application_producer"/>
      </xs:sequence>
    </xs:complexType>
  </xs:element>
  <xs:element name="duration" type="xs:nonNegativeInteger"/>
  <xs:element name="test_planning" type="xs:string"/>
  <xs:element name="report_writing" type="xs:string"/>
  <xs:element name="report_due" type="xs:string"/>
  <xs:element name="nature" type="xs:string"/>
  <xs:element name="type">
        <xs:simpleType>
          <xs:restriction base="xs:string">
            <xs:enumeration value="black-box"/>
            <xs:enumeration value="crystal-box"/>
            <xs:enumeration value="grey-box"/>
          </xs:restriction>
        </xs:simpleType>
  </xs:element>
  <xs:element name="fee" type="xs:string"/>
  <xs:element name="target_application" type="xs:string"/>
  <xs:element name="target_application_producer" type="xs:string"/>
  <xs:element name="version_history">
    <xs:complexType>
      <xs:sequence>
        <xs:element maxOccurs="unbounded" ref="version"/>
      </xs:sequence>
    </xs:complexType>
  </xs:element>
  <xs:element name="version">
    <xs:complexType>
      <xs:sequence>
        <xs:element ref="v_author" maxOccurs="unbounded"/>
        <xs:element ref="v_description"/>
      </xs:sequence>
      <xs:attribute name="date" use="required" type="xs:dateTime"/>
      <xs:attribute name="number" use="required" type="xs:NMTOKEN"/>
    </xs:complexType>
  </xs:element>
  <xs:element name="contact">
    <xs:complexType>
      <xs:sequence>
        <xs:element ref="name"/>
        <xs:element ref="address"/>
        <xs:element ref="email"/>
      </xs:sequence>
      <xs:attribute ref="xml:base"/>
    </xs:complexType>
  </xs:element>
  <xs:element name="address">
    <xs:complexType mixed="true">
      <xs:choice minOccurs="0" maxOccurs="unbounded">
        <xs:element ref="br"/>
        <xs:group ref="placeholders"></xs:group>
      </xs:choice>
    </xs:complexType>
  </xs:element>
  <xs:element name="phone" type="xs:string"/>
  <xs:element name="email" type="xs:string"/>
  <xs:element name="generate_targets">
    <xs:complexType/>
  </xs:element>
  <xs:element name="annex">
    <xs:complexType>
      <xs:sequence>
        <xs:element ref="title"/>
        <xs:choice maxOccurs="unbounded">
          <xs:element name="p" type="block"/>
          <xs:element ref="pre"/>
          <xs:element ref="code"/>
          <xs:element ref="table"/>
          <xs:element ref="ol"/>
          <xs:element ref="ul"/>
          <xs:element ref="img"/>
          <xs:element ref="section"/>
          <xs:element ref="generate_targets"/>
        </xs:choice>
      </xs:sequence>
      <xs:attribute ref="xml:base"/>
    </xs:complexType>
  </xs:element>
  <xs:element name="generate_waivers"/>
  <xs:element name="title">
    <xs:complexType mixed="true">
      <xs:choice minOccurs="0" maxOccurs="unbounded">
        <xs:element ref="br"/>
        <xs:group ref="placeholders"/>
      </xs:choice>
    </xs:complexType>
  </xs:element>
  <xs:element name="v_author" type="xs:string"/>
  <xs:element name="v_description" type="xs:string"/>
  <xs:element name="name">
    <xs:complexType mixed="true">
      <xs:choice minOccurs="0" maxOccurs="unbounded">
        <xs:group ref="placeholders"></xs:group>
      </xs:choice>
    </xs:complexType>
  </xs:element>
  <xs:element name="br">
    <xs:complexType/>
  </xs:element>
  <xs:element name="section">
    <xs:complexType>
      <xs:sequence>
        <xs:element ref="title"/>
        <xs:choice minOccurs="0" maxOccurs="unbounded">
          <xs:element ref="pre"/>
          <xs:element ref="code"/>
          <xs:element name="p" type="block"/>
          <xs:element ref="section"/>
          <xs:element ref="table"/>
          <xs:element ref="ul"/>
          <xs:element ref="ol"/>
          <xs:element ref="img"/>
          <xs:element ref="generate_targets"/>
          <xs:element ref="contact"/>
          <xs:element ref="generate_offer_signature_box"/>
        </xs:choice>
      </xs:sequence>
      <xs:attribute name="break" use="optional">
        <xs:simpleType> 
          <xs:restriction base="xs:string"> 
            <xs:enumeration value="before"/>
            <xs:enumeration value="after"/>
          </xs:restriction> 
        </xs:simpleType>
      </xs:attribute>
      <xs:attribute ref="xml:base"/>
    </xs:complexType>
  </xs:element>
  <xs:element name="table">
    <xs:complexType>
      <xs:sequence>
        <xs:element maxOccurs="unbounded" ref="tr"/>
      </xs:sequence>
      <xs:attribute name="border" use="optional" type="xs:integer"/>
      <xs:attribute name="cols" use="optional" type="xs:string"/>
    </xs:complexType>
  </xs:element>
  <xs:element name="tr">
    <xs:complexType>
      <xs:choice maxOccurs="unbounded" minOccurs="1">
        <xs:element ref="td"/>
        <xs:element ref="th"/>
      </xs:choice>
    </xs:complexType>
  </xs:element>
  <xs:element name="td">
    <xs:complexType mixed="true">
      <xs:choice maxOccurs="unbounded">
        <xs:element minOccurs="0" maxOccurs="unbounded" ref="a"/>
        <xs:element minOccurs="0" maxOccurs="unbounded" ref="b"/>
        <xs:element minOccurs="0" maxOccurs="unbounded" ref="br"/>
        <xs:element minOccurs="0" maxOccurs="unbounded" ref="i"/>
        <xs:element minOccurs="0" maxOccurs="unbounded" ref="u"/>
        <xs:group ref="placeholders"/>
      </xs:choice>
    </xs:complexType>
  </xs:element>
  <xs:element name="th" type="xs:string"/>
  <xs:element name="ul">
    <xs:complexType>
      <xs:sequence>
        <xs:element maxOccurs="unbounded" name="li" type="li"/>
      </xs:sequence>
    </xs:complexType>
  </xs:element>
  <xs:element name="ol">
    <xs:complexType>
      <xs:sequence>
        <xs:element maxOccurs="unbounded" name="li" type="li"/>
      </xs:sequence>
      <xs:attribute name="type" use="optional">
        <xs:simpleType>
          <xs:restriction base="xs:string">
            <xs:enumeration value="a"/>
            <xs:enumeration value="A"/>
            <xs:enumeration value="i"/>
            <xs:enumeration value="I"/>
          </xs:restriction>
        </xs:simpleType>
      </xs:attribute>
    </xs:complexType>
  </xs:element>
  <xs:complexType name="block" mixed="true">
    <xs:choice maxOccurs="unbounded">
      <xs:element minOccurs="0" maxOccurs="unbounded" ref="a"/>
      <xs:element minOccurs="0" maxOccurs="unbounded" ref="b"/>
      <xs:element minOccurs="0" maxOccurs="unbounded" ref="br"/>
      <xs:element minOccurs="0" maxOccurs="unbounded" ref="i"/>
      <xs:element minOccurs="0" maxOccurs="unbounded" ref="u"/>
      <xs:element minOccurs="0" maxOccurs="unbounded" ref="generate_permission_parties"/>
      <xs:group ref="placeholders"/>
    </xs:choice>
    <xs:attribute ref="xml:base"/>
  </xs:complexType>
  <xs:complexType name="li" mixed="true">
    <xs:choice maxOccurs="unbounded">
      <xs:element minOccurs="0" maxOccurs="unbounded" ref="a"/>
      <xs:element minOccurs="0" maxOccurs="unbounded" ref="b"/>
      <xs:element minOccurs="0" maxOccurs="unbounded" ref="br"/>
      <xs:element minOccurs="0" maxOccurs="unbounded" ref="i"/>
      <xs:element minOccurs="0" maxOccurs="unbounded" ref="u"/>
      <xs:element minOccurs="0" maxOccurs="unbounded" ref="ul"/>
      <xs:element minOccurs="0" maxOccurs="unbounded" ref="ol"/>
        <xs:group ref="placeholders"/>
    </xs:choice>
  </xs:complexType>
  <xs:element name="generate_offer_signature_box"/>
  <xs:element name="generate_permission_parties"/>
  <xs:element name="img">
    <xs:complexType>
      <xs:attribute name="height" use="optional" type="xs:integer"/>
      <xs:attribute name="width" use="optional" type="xs:integer"/>
      <xs:attribute name="src" use="required"/>
    </xs:complexType>
  </xs:element>
  <xs:element name="pre">
    <xs:complexType mixed="true">
      <xs:choice>
        <xs:element minOccurs="0" maxOccurs="unbounded" ref="a"/>
        <xs:element minOccurs="0" maxOccurs="unbounded" ref="b"/>
        <xs:element minOccurs="0" maxOccurs="unbounded" ref="br"/>
        <xs:element minOccurs="0" maxOccurs="unbounded" ref="i"/>
        <xs:element minOccurs="0" maxOccurs="unbounded" ref="u"/>
        <xs:group ref="placeholders"/>
      </xs:choice>
    </xs:complexType>
  </xs:element>
  <xs:element name="code">
    <xs:complexType mixed="true">
      <xs:choice>
        <xs:element minOccurs="0" maxOccurs="unbounded" ref="a"/>
        <xs:element minOccurs="0" maxOccurs="unbounded" ref="b"/>
        <xs:element minOccurs="0" maxOccurs="unbounded" ref="br"/>
        <xs:element minOccurs="0" maxOccurs="unbounded" ref="i"/>
        <xs:element minOccurs="0" maxOccurs="unbounded" ref="u"/>
        <xs:group ref="placeholders"/>
      </xs:choice>
    </xs:complexType>
  </xs:element>
  <xs:element name="a">
    <xs:complexType>
      <xs:simpleContent>
        <xs:extension base="xs:string">
          <xs:attribute name="href" use="required" type="xs:anyURI"/>
        </xs:extension>
      </xs:simpleContent>
    </xs:complexType>
  </xs:element>
  <xs:element name="b">
    <xs:complexType mixed="true">
      <xs:choice maxOccurs="unbounded">
        <xs:element minOccurs="0" maxOccurs="unbounded" ref="a"/>
        <xs:element minOccurs="0" maxOccurs="unbounded" ref="br"/>
        <xs:element minOccurs="0" maxOccurs="unbounded" ref="i"/>
        <xs:element minOccurs="0" maxOccurs="unbounded" ref="u"/>
        <xs:element minOccurs="0" maxOccurs="unbounded" ref="monospace"/>
        <xs:group ref="placeholders"/>
      </xs:choice>
    </xs:complexType>
  </xs:element>
  <xs:element name="i">
    <xs:complexType mixed="true">
      <xs:choice maxOccurs="unbounded">
        <xs:element minOccurs="0" maxOccurs="unbounded" ref="a"/>
        <xs:element minOccurs="0" maxOccurs="unbounded" ref="b"/>
        <xs:element minOccurs="0" maxOccurs="unbounded" ref="br"/>
        <xs:element minOccurs="0" maxOccurs="unbounded" ref="u"/>
        <xs:element minOccurs="0" maxOccurs="unbounded" ref="monospace"/>
        <xs:group ref="placeholders"/>
      </xs:choice>
    </xs:complexType>
  </xs:element>
  <xs:element name="u">
    <xs:complexType mixed="true">
      <xs:choice maxOccurs="unbounded">
        <xs:element minOccurs="0" maxOccurs="unbounded" ref="a"/>
        <xs:element minOccurs="0" maxOccurs="unbounded" ref="b"/>
        <xs:element minOccurs="0" maxOccurs="unbounded" ref="br"/>
        <xs:element minOccurs="0" maxOccurs="unbounded" ref="i"/>
        <xs:element minOccurs="0" maxOccurs="unbounded" ref="monospace"/>
        <xs:group ref="placeholders"/>
      </xs:choice>
    </xs:complexType>
  </xs:element>
  <xs:element name="monospace">
    <xs:complexType mixed="true">
      <xs:choice maxOccurs="unbounded">
        <xs:element minOccurs="0" maxOccurs="unbounded" ref="a"/>
        <xs:element minOccurs="0" maxOccurs="unbounded" ref="b"/>
        <xs:element minOccurs="0" maxOccurs="unbounded" ref="br"/>
        <xs:element minOccurs="0" maxOccurs="unbounded" ref="i"/>
        <xs:element minOccurs="0" maxOccurs="unbounded" ref="u"/>
        <xs:group ref="placeholders"/>
      </xs:choice>
    </xs:complexType>
  </xs:element>
  
  <!-- Placeholders -->
  <xs:group name="placeholders">
    <xs:choice>
      <xs:element name="c_long"/>
      <xs:element name="c_short"/>
      <xs:element name="c_street"/>
      <xs:element name="c_city"/>
      <xs:element name="c_country"/>
      <xs:element name="c_coc"/>
      <xs:element name="c_legal_rep"/>
      <xs:element name="c_waiver_rep"/>
      <xs:element name="c_poc1"/>
      <xs:element name="ros_long"/>
      <xs:element name="ros_short"/>
      <xs:element name="ros_svc_long"/>
      <xs:element name="ros_svc_short"/>
      <xs:element name="ros_legal_rep"/>
      <xs:element name="ros_poc1"/>
      <xs:element name="t_app"/>
      <xs:element name="t_app_producer"/>
      <xs:element name="p_duration"/>
      <xs:element name="p_boxtype"/>
      <xs:element name="p_fee"/>
      <xs:element name="p_testingduration"/>
      <xs:element name="p_reportwritingduration"/>
      <xs:element name="p_reportdue"/>
    </xs:choice>
</xs:group>
</xs:schema>
