<?xml version="1.0" encoding="UTF-8"?>
<!DOCTYPE offerte  
[
    <!-- variable entities, to be filled in by the report writer -->
   
    <!-- CUSTOMER -->
    <!ENTITY c_long "..."> <!-- long client name, e.g. Sitting Duck B.V. -->
    <!ENTITY c_short "..."> <!-- short client name, e.g. Sitting Duck -->
    <!ENTITY c_coc "..."><!-- Chamber of Commerce number -->
    <!ENTITY c_street "..."> <!-- client street & number -->
    <!ENTITY c_city "..."> <!-- client city -->
    <!ENTITY c_country "..."> <!-- client country -->
    <!ENTITY c_legal_rep "..."><!-- customer legal representative (to sign offer) -->
    <!ENTITY c_waiver_rep "..."><!-- customer legal representative (to sign waiver) -->
    <!ENTITY c_poc1 "..."><!-- first point of contact for customer -->
    <!-- PROJECT -->
    <!ENTITY p_duration "..."> <!-- number of days -->
    <!ENTITY p_boxtype "crystal-box"> <!-- crystal-box, grey-box, or black-box -->
    <!ENTITY p_fee "..."> <!-- just the number (€ is added later) -->
    <!ENTITY p_testingduration "..."> <!-- date or date range in text, e.g. May 18th until May 25th, 2015 -->
    <!ENTITY p_reportwritingduration "..."> <!-- idem -->
    <!ENTITY p_reportdue "..."> <!-- date in text, e.g. May 31st, 2015 -->
    <!-- Is there an app to be tested? Put it here so included app snippets can use it -->
    <!ENTITY t_app "...">
    <!ENTITY t_app_producer "...">
]>
<offerte xmlns:xsi="http://www.w3.org/2001/XMLSchema-instance" xsi:noNamespaceSchemaLocation="../dtd/offerte.xsd">
    
    <!-- document meta information; to be filled in by the offerte writer  -->
    <meta>
        <offered_service_long>penetration testing services</offered_service_long>
        <offered_service_short>penetration test</offered_service_short>
        <xi:include href="snippets/ros_info.xml"/>
        <targets> <!-- one target element per target -->
            <target>...</target>
        </targets>
        <permission_parties>
            <client><!-- mandatory; please add client information -->
                <full_name>...</full_name><!-- long client name, e.g. Sitting Duck B.V. -->
                <short_name>...</short_name> <!-- short client name, e.g. Sitting Duck; if no short name: same as long name -->
                <legal_rep>...</legal_rep><!-- customer legal representative (to sign offer) -->
                <waiver_rep>...</waiver_rep><!-- customer legal representative (to sign waiver; can be same person as legal_rep) -->
                <poc1>...</poc1><!-- first point of contact for customer (during pentest); can be same person as above -->
                <address>...</address>
                <city>...</city> 
                <country>...</country>
                <coc nationality="Dutch">...</coc><!-- chamber of commerce number; if no chamber of commerce number, please delete the whole element -->
            </client>
            <party><!-- optional; if no other party needs to give permission, please remove whole party element -->
                <full_name>...</full_name>
                <short_name>...</short_name> <!-- short party name; if no short name: same as long name -->
                <waiver_rep>...</waiver_rep> 
                <address>...</address>
                <city>...</city> 
                <country>...</country>
            </party>
        </permission_parties>
        <pentestinfo>
            <duration>...</duration><!-- duration of pentest, in working days -->
            <test_planning>...</test_planning> <!-- date or date range in text, e.g. May 18th until May 25th, 2015 -->
            <report_writing>...</report_writing> <!-- date or date range in text, e.g. May 18th until May 25th, 2015 -->
            <report_due>...</report_due> <!-- date or date range in text, e.g. May 18th until May 25th, 2015 -->
            <type>...</type><!-- please choose one of the following: black-box, grey-box, crystal-box -->
            <fee>...</fee><!-- euro is added automatically in the document -->
            <target_application>...</target_application><!-- name of application to be tested (if any; if none, delete target_application element) -->
        </pentestinfo>
        <version_history><!-- needed for date on frontpage and in signature boxes; add a new <version> after each review and make sure to update the date/time -->
            <version date="2015-06-08T10:00:00" number="auto"> <!-- actual date-time here; you can leave the number attribute alone -->
                <v_author>ROS Writer</v_author> <!-- name of the author here -->
                <v_description>Initial draft</v_description>
            </version>
        </version_history>
    </meta>
     <section>
        <title>Introduction</title>
        <p><c_long/> (hereafter “<b><c_short/></b>”), with its registered office at <c_street/>, <c_city/>, <c_country/>, has requested <ros_long/> (hereafter “<b><ros_short/></b>”) to perform <ros_svc_long/>. Motivation for this request is that <c_short/> wishes to get a better insight in ...</p>
<xi:include href="snippets/offerte/setoutscope.xml"/>
</section>
</section>
    <section><!-- section with some more info on the application (if any) -->
        <title>The &t_app; Application</title>
        <p>&t_app; is a ...</p>
        <p>...</p>
    </section>
    <section><!-- section with some more info on the target infrastructure-->
        <title>The &c_short; Infrastructure</title>
        <p>...</p>
    </section>

<!-- Project overview section (complete section is in a snippet) -->
<xi:include href="snippets/offerte/projectoverview.xml"/>

    <section>
        <title>Pentest Scope</title>
        <p>...</p>
    </section>
    
    <!-- Prerequisites section (complete section is in a snippet) -->
    <xi:include href="snippets/offerte/prerequisites.xml"/>
    
    <!-- Disclaimer section (complete section is in a snippet) -->
    <xi:include href="snippets/offerte/disclaimer.xml"/>
    
    <!-- Pentest Methodology section (complete section is in a snippet) -->
    <xi:include href="snippets/offerte/pentestmethodology.xml"/>
    <xi:include href="snippets/offerte/codeauditmethodology.xml"/><!-- DELETE IF NOT APPLICABLE -->
    
    <!-- Team and Reporting section (complete section is in a snippet) -->
    <xi:include href="snippets/offerte/teamandreporting.xml"/>

<!-- Planning and payment section (complete section is in a snippet) -->
<xi:include href="snippets/offerte/planningandpayment.xml"/> 

    <!-- About ROS section (complete section is in a snippet) -->
<xi:include href="snippets/offerte/aboutros.xml"/>
<!-- Work condition section (complete section is in a snippet) -->
<xi:include href="snippets/offerte/conditions.xml"/>
<!-- General terms and conditions section (complete section is in a snippet) -->
<xi:include href="snippets/offerte/generaltermsandconditions.xml"/>
<generate_waivers/>
</offerte>
