<?xml version="1.0" encoding="UTF-8"?><offerte xmlns:xsi="http://www.w3.org/2001/XMLSchema-instance" xmlns:xi="http://www.w3.org/2001/XInclude" xmlns:xlink="http://www.w3.org/1999/xlink" xmlns:fo="http://www.w3.org/1999/XSL/Format" xsi:noNamespaceSchemaLocation="../dtd/offerte.xsd"><!--document meta information; to be filled in by the offerte writer--><meta><offered_service_long>penetration testing services</offered_service_long><!--if there is a shorter way of saying the same thing, you can type it here (it makes for more dynamic offerte text). If not, just repeat the long name.--><offered_service_short>penetration test</offered_service_short><xi:include href="snippets/ros_info.xml"/><targets><!--one target element per target--><target>fishinabarrel.sittingduck.nl</target><target>intothegreatwideopen.sittingduck.nl</target><target>iSoftware(tm)</target></targets><permission_parties><client><!--mandatory; please add client information--><full_name>Sitting Duck B.V.</full_name><!--long client name, e.g. Sitting Duck B.V.--><short_name>Sitting Duck</short_name><!--short client name, e.g. Sitting Duck; if no short name: same as long name--><legal_rep>I.M. Portant</legal_rep><!--customer legal representative (to sign offer)--><waiver_rep>B.I.G. Wig</waiver_rep><!--customer legal representative (to sign waiver; can be same person as legal_rep)--><poc1>Sir Knowsalot</poc1><!--first point of contact for customer (during pentest); can be same person as above--><address>Reed Street 42</address><city>Pond City</city><country>Amazonia</country><coc nationality="Dutch">99999999</coc><!--chamber of commerce number; if no chamber of commerce number, please delete the whole element--></client><party><full_name>Programmers 'R' Us Inc.</full_name><short_name>PRU Inc.</short_name><!--short party name; if no short name: same as long name--><waiver_rep>P. Rogram</waiver_rep><address>Cave 99</address><city>Darkest Dungeon</city><country>Underworld</country></party></permission_parties><pentestinfo><duration>5</duration><!--duration of pentest, in working days--><test_planning>beginning of January 2015</test_planning><!--date or date range in text, e.g. May 18th until May 25th, 2015--><report_writing>???</report_writing><!--date or date range in text, e.g. May 18th until May 25th, 2015--><report_due>January 20th, 2015</report_due><!--date or date range in text, e.g. May 18th until May 25th, 2015--><nature>time-boxed</nature><type>grey-box</type><!--please choose one of the following: black-box, grey-box, crystal-box--><fee>200000</fee><!--euro is added automatically in the document--><target_application>FishInABarrel</target_application><!--name of application/serice to be tested (if any; if none, delete target_application element)--></pentestinfo><version_history><!--needed for date on frontpage and in signature boxes; it is possible to add a new <version> after each review; in that case, make sure to update the date/time--><version number="auto" date="2015-01-01T10:00:00"><!--actual date-time here; you can leave the number attribute alone--><v_author>ROS Writer</v_author><!--name of the author here; for internal use only--><v_description>Initial
                        draft</v_description><!--for internal use only--></version></version_history></meta><section><title>Introduction</title><p><c_long/> (hereafter “<b><c_short/></b>”), with its registered office at
                    <c_street/>, <c_city/>, <c_country/>, has requested <ros_long/> (hereafter
                        “<b><ros_short/></b>”) to perform <ros_svc_long/> on the following targets.</p><xi:include href="snippets/offerte/setoutscope.xml"/></section><!--Project overview section (complete section is in a snippet)--><xi:include href="snippets/offerte/projectoverview.xml"/><!--Prerequisites section (complete section is in a snippet)--><xi:include href="snippets/offerte/prerequisites.xml"/><!--Disclaimer section (complete section is in a snippet)--><xi:include href="snippets/offerte/disclaimer.xml"/><!--Pentest Methodology section--><xi:include href="snippets/offerte/pentestmethodology.xml"/><xi:include href="snippets/offerte/codeauditmethodology.xml"/><xi:include href="snippets/offerte/teamandreporting.xml"/><!--Planning and payment section (complete section is in a snippet)--><xi:include href="snippets/offerte/planningandpayment.xml"/><!--About ROS section (complete section is in a snippet)--><xi:include href="snippets/offerte/aboutros.xml"/><!--Work condition section (complete section is in a snippet)--><xi:include href="snippets/offerte/conditions.xml"/><!--General terms and conditions section (complete section is in a snippet)--><xi:include href="snippets/offerte/generaltermsandconditions.xml"/><!--Waivers--><generate_waivers/></offerte>